{
  "$schema": "https://json-schema.org/draft/2020-12/schema",
  "$id": "https://manta.local/schemas/capture-1.0.0.json",
  "title": "MANTA Capture Metadata 1.0.0",
  "type": "object",
  "required": ["$schema", "schemaVersion", "sessionID", "captureMode", "layoutID", "coordinateSystems", "observations"],
  "properties": {
    "$schema": { "type": "string" },
    "schemaVersion": { "type": "string", "pattern": "^1\\.[0-9]+\\.[0-9]+$" },
    "sessionID": { "type": "string", "format": "uuid" },
    "captureMode": { "enum": ["lidar", "photogrammetry", "both"] },
    "layoutID": { "type": "string", "minLength": 1 },
    "coordinateSystems": {
      "type": "array",
      "minItems": 1,
      "items": {
        "type": "object",
        "required": ["id", "handedness", "units", "description"],
        "properties": {
          "id": { "type": "string", "minLength": 1 },
          "handedness": { "enum": ["right", "left"] },
          "units": { "enum": ["meters", "centimeters", "millimeters"] },
          "description": { "type": "string" }
        },
        "additionalProperties": true
      }
    },
    "reconstruction": {
      "type": "object",
      "required": ["worldCoordinateSystem"],
      "properties": {
        "lidarMeshPath": { "type": "string", "minLength": 1 },
        "headCroppedLidarMeshPath": { "type": "string", "minLength": 1 },
        "objectCaptureModelPath": { "type": "string", "minLength": 1 },
        "headBoundingBox": {
          "type": "object",
          "required": ["center", "widthMeters", "heightMeters", "depthMeters"],
          "properties": {
            "center": {
              "type": "object",
              "required": ["x", "y", "z"],
              "properties": {
                "x": { "type": "number" },
                "y": { "type": "number" },
                "z": { "type": "number" }
              },
              "additionalProperties": false
            },
            "widthMeters": { "type": "number", "exclusiveMinimum": 0 },
            "heightMeters": { "type": "number", "exclusiveMinimum": 0 },
            "depthMeters": { "type": "number", "exclusiveMinimum": 0 }
          },
          "additionalProperties": false
        },
        "modelToWorld": { "type": "array", "minItems": 16, "maxItems": 16, "items": { "type": "number" } },
        "worldCoordinateSystem": { "type": "string", "minLength": 1 }
      },
      "anyOf": [
        { "required": ["lidarMeshPath"] },
        { "required": ["headCroppedLidarMeshPath"] },
        { "required": ["objectCaptureModelPath"] },
        { "required": ["headBoundingBox"] }
      ],
      "additionalProperties": false
    },
    "observations": {
      "type": "array",
      "items": {
        "type": "object",
        "required": ["id", "capturedAt", "imageDimensions", "imageOrigin", "imageOrientation", "intrinsics", "cameraToWorld", "worldCoordinateSystem", "trackingState"],
        "properties": {
          "id": { "type": "string", "format": "uuid" },
          "capturedAt": { "type": "string", "format": "date-time" },
          "imagePath": { "type": "string", "minLength": 1 },
          "imageDimensions": { "$ref": "#/$defs/dimensions" },
          "imageOrigin": { "const": "top-left" },
          "imageOrientation": { "type": "string", "minLength": 1 },
          "intrinsics": { "type": "array", "minItems": 9, "maxItems": 9, "items": { "type": "number" } },
          "cameraToWorld": { "type": "array", "minItems": 16, "maxItems": 16, "items": { "type": "number" } },
          "worldCoordinateSystem": { "type": "string", "minLength": 1 },
          "trackingState": { "type": "string", "minLength": 1 },
          "quality": { "$ref": "#/$defs/quality" }
        },
        "additionalProperties": true
      }
    }
  },
  "$defs": {
    "dimensions": {
      "type": "object",
      "required": ["width", "height"],
      "properties": {
        "width": { "type": "integer", "minimum": 1 },
        "height": { "type": "integer", "minimum": 1 }
      },
      "additionalProperties": false
    },
    "quality": {
      "type": "object",
      "required": ["arFrameTimestamp", "worldMappingStatus", "meanLuminance", "darkPixelFraction", "brightPixelFraction", "sharpnessScore", "coverageSector", "warnings"],
      "properties": {
        "arFrameTimestamp": { "type": "number" },
        "worldMappingStatus": { "type": "string", "minLength": 1 },
        "ambientIntensity": { "type": "number" },
        "ambientColorTemperature": { "type": "number" },
        "meanLuminance": { "type": "number", "minimum": 0, "maximum": 1 },
        "darkPixelFraction": { "type": "number", "minimum": 0, "maximum": 1 },
        "brightPixelFraction": { "type": "number", "minimum": 0, "maximum": 1 },
        "sharpnessScore": { "type": "number", "minimum": 0 },
        "translationFromPreviousSampleMeters": { "type": "number", "minimum": 0 },
        "rotationFromPreviousSampleDegrees": { "type": "number", "minimum": 0 },
        "coverageSector": { "type": "string", "minLength": 1 },
        "headCenteredCoverageSector": { "type": "string", "minLength": 1 },
        "validDepthFraction": { "type": "number", "minimum": 0, "maximum": 1 },
        "highConfidenceDepthFraction": { "type": "number", "minimum": 0, "maximum": 1 },
        "warnings": { "type": "array", "items": { "type": "string" } }
      },
      "additionalProperties": true
    }
  },
  "additionalProperties": true
}
