{
  "$schema" : "https://manta.local/schemas/capture-1.0.0.json",
  "captureMode" : "both",
  "coordinateSystems" : [
    {
      "description" : "Right-handed ARKit world frame; camera looks down negative Z.",
      "handedness" : "right",
      "id" : "arkit-world",
      "units" : "meters"
    }
  ],
  "layoutID" : "egi-hydrocel-128",
  "observations" : [
    {
      "cameraToWorld" : [1, 0, 0, 0, 0, 1, 0, 0, 0, 0, 1, 0, 0, 0, 0, 1],
      "capturedAt" : "2026-07-11T13:30:23Z",
      "id" : "c8243f13-27d7-4c07-a18d-12680cf22b55",
      "imageDimensions" : { "height" : 1440, "width" : 1920 },
      "imageOrigin" : "top-left",
      "imageOrientation" : "up",
      "intrinsics" : [1600, 0, 0, 0, 1600, 0, 960, 720, 1],
      "trackingState" : "normal",
      "worldCoordinateSystem" : "arkit-world"
    },
    {
      "cameraToWorld" : [1, 0, 0, 0, 0, 1, 0, 0, 0, 0, 1, 0, 0.1, 0, 0, 1],
      "capturedAt" : "2026-07-11T13:30:24Z",
      "id" : "2a65f34c-ea3e-47af-b351-527b74d61a30",
      "imageDimensions" : { "height" : 1440, "width" : 1920 },
      "imageOrigin" : "top-left",
      "imageOrientation" : "up",
      "intrinsics" : [1600, 0, 0, 0, 1600, 0, 960, 720, 1],
      "trackingState" : "normal",
      "worldCoordinateSystem" : "arkit-world"
    }
  ],
  "schemaVersion" : "1.0.0",
  "sessionID" : "c75cf330-8751-46f3-bcd4-7bef70b28ee8"
}

